{
  "schema_version": "0.1.0",
  "request_id": "req_population_emissions",
  "question": "How does population size affect territorial carbon dioxide emissions across countries from 1990 to 2020?",
  "domains": ["demography", "environmental economics", "climate science"],
  "inference_goal": "causal",
  "target_population": "Countries and territories with comparable annual observations",
  "unit_of_analysis": "country-year",
  "spatial_scope": "global",
  "temporal_scope": "1990-2020",
  "constructs": [
    {
      "name": "population size",
      "proposed_role": "exposure",
      "status": "user_specified",
      "notes": "Alternative specifications may use population growth or density."
    },
    {
      "name": "territorial carbon dioxide emissions",
      "proposed_role": "outcome",
      "status": "user_specified",
      "notes": "Must distinguish production-based from consumption-based emissions."
    },
    {
      "name": "energy use",
      "proposed_role": "mediator",
      "status": "agent_proposed",
      "notes": "Potential mechanism connecting population and emissions."
    },
    {
      "name": "income per capita",
      "proposed_role": "confounder",
      "status": "agent_proposed",
      "notes": "Development level may affect both demographic patterns and emissions."
    },
    {
      "name": "industrial structure",
      "proposed_role": "moderator",
      "status": "agent_proposed",
      "notes": "The population-emissions relationship may vary by sectoral composition."
    }
  ],
  "data_preferences": {
    "preferred_modalities": ["tabular"],
    "prohibited_modalities": [],
    "objective_subjective": "objective",
    "microdata_required": false
  },
  "constraints": {
    "open_data_only": true,
    "registration_allowed": true,
    "commercial_data_allowed": false,
    "sensitive_data_allowed": false,
    "languages": ["English"],
    "compute_notes": null,
    "other": "Prefer versioned annual data with stable country identifiers."
  }
}
